{
  "schema_version": "r28-independent-authoring-output-v3",
  "contract_id": "dolved-v4-independent-authoring-output-v3",
  "population_id": "dolved-v4-independent-comparison-compat-v2",
  "restricted_view": {
    "view_id": "dolved-care-v4-question-author-view-v1",
    "sha256": "8f73c9c12a843be9641698f39db60243a977e6c1c700a3f89f72dbbb890e44b9"
  },
  "author_provenance": {
    "authoring_run_id": "AUTHOR-V4-20260904-C9W2P6LX",
    "author_identity": "Independent Dolved V4 question author",
    "authored_at_utc": "2026-09-04T13:04:58Z",
    "method": "fresh-independent-authoring-without-system-output"
  },
  "cases": [
    {
      "case_id": "v4.case.corrected-b01-01",
      "scope": "primary",
      "variants": [
        {
          "variant_id": "v1",
          "utterance": "As a new starter, which wellbeing services should I know about, and how will my induction check that I know how to access them?"
        },
        {
          "variant_id": "v2",
          "utterance": "What wellbeing help should I learn about when I join, and what will the induction check ask me to demonstrate about accessing it?"
        }
      ],
      "context": {
        "organisation": "Alderbridge Care Group",
        "location_id": null,
        "temporal_mode": "CURRENT",
        "as_of_date": null,
        "requester_role": "employee"
      },
      "expected_outcome": {
        "retrieval": "EVIDENCE_FOUND",
        "generation": "answered"
      },
      "expected_evidence": [
        {
          "evidence_id": "ev-b01-001-500",
          "side": "PRIMARY",
          "restricted_view_path": "documents/primary/staff-handbook-full-manual-v3.txt",
          "source_sha256": "dc5b2be06d1a4fcb9d6048b616ea301090d1ec247ddcb5baf3ff43e48091462c",
          "quotation": "This version introduces a single consolidated summary of the wellbeing support and benefits available to every employee: the Employee Assistance Programme, offering confidential counselling and practical advice; the death-in-service benefit provided through the workplace pension scheme; access to an occupational health referral where a health condition affects someone's ability to work; and a wellbeing check-in offered as part of the return-to-work process following a period of sickness absence."
        },
        {
          "evidence_id": "ev-b01-001-329",
          "side": "PRIMARY",
          "restricted_view_path": "documents/primary/staff-handbook-full-manual-v3.txt",
          "source_sha256": "dc5b2be06d1a4fcb9d6048b616ea301090d1ec247ddcb5baf3ff43e48091462c",
          "quotation": "A new starter is asked, as part of their induction check-in, a simple question confirming they know how to access the Employee Assistance Programme and who to contact for an occupational health referral, a small but deliberate check that the new consolidated summary has actually landed rather than being read once and forgotten."
        }
      ],
      "rationale": "Both separated passages are necessary: one defines the available support and the other defines the induction verification.",
      "slices": [
        "applicability.global",
        "format.txt",
        "outcome.EVIDENCE_FOUND",
        "scope.primary",
        "structure.boundary_spanning_evidence",
        "structure.long_document",
        "temporal.current",
        "wording.multi_part"
      ]
    },
    {
      "case_id": "v4.case.corrected-b01-02",
      "scope": "primary",
      "variants": [
        {
          "variant_id": "v1",
          "utterance": "Who was the internal gas-leak escalation contact before March 2026, and who replaced them from that month?"
        },
        {
          "variant_id": "v2",
          "utterance": "How did the internal contact used after calling the gas emergency service change in March 2026?"
        }
      ],
      "context": {
        "organisation": "Alderbridge Care Group",
        "location_id": null,
        "temporal_mode": "COMPARE",
        "as_of_date": null,
        "requester_role": "employee"
      },
      "expected_outcome": {
        "retrieval": "EVIDENCE_FOUND",
        "generation": "answered"
      },
      "expected_evidence": [
        {
          "evidence_id": "ev-b01-002-144",
          "side": "COMPARISON",
          "restricted_view_path": "documents/primary/gas-safety-procedure-v1.docx",
          "source_sha256": "f27ffe3b41fe57c7c076535592facd422bb20f39509a8150726df7f73d46403e",
          "quotation": "Notify the Facilities Lead on the internal escalation line once the emergency call has been made, so the site's own response can be coordinated."
        },
        {
          "evidence_id": "ev-b01-002-187",
          "side": "PRIMARY",
          "restricted_view_path": "documents/primary/gas-safety-procedure-v2.docx",
          "source_sha256": "77df6675e3e80060deb9ba76bd42f0ceed6df8b3d83a2d9903378ebe1ab80239",
          "quotation": "Notify the 24-hour Estates Helpdesk once the emergency call has been made; this has replaced the previous direct line to the Facilities Lead, particularly improving out-of-hours coverage."
        }
      ],
      "rationale": "The old and new action passages establish both sides of the contact and escalation change.",
      "slices": [
        "applicability.global",
        "change.contact",
        "change.escalation",
        "competition.near_duplicate",
        "format.docx",
        "outcome.EVIDENCE_FOUND",
        "scope.primary",
        "temporal.comparison",
        "wording.ordinary_employee"
      ]
    },
    {
      "case_id": "v4.case.corrected-b01-03",
      "scope": "foreign_tenant",
      "variants": [
        {
          "variant_id": "v1",
          "utterance": "What phrase should I use over the radio to summon all on-duty Alderbridge staff to a life-threatening emergency?"
        },
        {
          "variant_id": "v2",
          "utterance": "If there is a critical emergency, what radio call brings every member of our on-duty team immediately?"
        }
      ],
      "context": {
        "organisation": "Alderbridge Care Group",
        "location_id": null,
        "temporal_mode": "CURRENT",
        "as_of_date": null,
        "requester_role": "employee"
      },
      "expected_outcome": {
        "retrieval": "NO_ELIGIBLE_EVIDENCE",
        "generation": null
      },
      "expected_evidence": [],
      "rationale": "A relevant-looking phrase is visible only in Thornfield material, which cannot answer an Alderbridge request; this is not clarification because organisation and need are explicit, and not no-candidate because a candidate exists but is ineligible.",
      "slices": [
        "format.txt",
        "outcome.NO_ELIGIBLE_EVIDENCE",
        "safety.cross_tenant",
        "scope.foreign_tenant",
        "temporal.current",
        "wording.ordinary_employee"
      ]
    },
    {
      "case_id": "v4.case.corrected-b01-04",
      "scope": "primary",
      "variants": [
        {
          "variant_id": "v1",
          "utterance": "How often were highest-risk residents repositioned before January 2026, and what interval applies after the change?"
        },
        {
          "variant_id": "v2",
          "utterance": "What changed in January 2026 about the repositioning schedule for residents in the highest-risk category?"
        }
      ],
      "context": {
        "organisation": "Alderbridge Care Group",
        "location_id": null,
        "temporal_mode": "COMPARE",
        "as_of_date": null,
        "requester_role": "employee"
      },
      "expected_outcome": {
        "retrieval": "EVIDENCE_FOUND",
        "generation": "answered"
      },
      "expected_evidence": [
        {
          "evidence_id": "ev-b01-004-103",
          "side": "COMPARISON",
          "restricted_view_path": "documents/primary/pressure-area-care-policy-v1.pdf",
          "source_sha256": "a2bcd6c80b5b99c00841a1918a800bda9b9a508bb67f3f7a0dfbe88650c15348",
          "quotation": "A resident assessed at high risk of pressure damage is repositioned at least every 4 hours, recorded on"
        },
        {
          "evidence_id": "ev-b01-004-106",
          "side": "PRIMARY",
          "restricted_view_path": "documents/primary/pressure-area-care-policy-v2.pdf",
          "source_sha256": "23b3b9aced7e01e66d599aeac912a693081aba1877a73cadfc9295878d010e80",
          "quotation": "A resident assessed at high risk of pressure damage is repositioned at least every 2 hours, tightened from"
        }
      ],
      "rationale": "The two versions supply the former four-hour and current two-hour requirements for the same risk category.",
      "slices": [
        "applicability.global",
        "change.number",
        "competition.near_duplicate",
        "format.pdf",
        "outcome.EVIDENCE_FOUND",
        "scope.primary",
        "temporal.comparison",
        "wording.ordinary_employee"
      ]
    },
    {
      "case_id": "v4.case.corrected-b01-05",
      "scope": "primary",
      "variants": [
        {
          "variant_id": "v1",
          "utterance": "Two residents developed similar symptoms within 48 hours. What immediate action should we take, and what evidence of using that process must be retained?"
        },
        {
          "variant_id": "v2",
          "utterance": "When two residents become similarly ill inside two days, what is the immediate response and which record shows that the outbreak decision process was followed?"
        }
      ],
      "context": {
        "organisation": "Alderbridge Care Group",
        "location_id": null,
        "temporal_mode": "CURRENT",
        "as_of_date": null,
        "requester_role": "employee"
      },
      "expected_outcome": {
        "retrieval": "EVIDENCE_FOUND",
        "generation": "answered"
      },
      "expected_evidence": [
        {
          "evidence_id": "ev-b01-005-150",
          "side": "PRIMARY",
          "restricted_view_path": "documents/primary/infection-control-full-manual-v3.docx",